
*** Running vivado
    with args -log top_processing.vdi -applog -m64 -product Vivado -messageDb vivado.pb -mode batch -source top_processing.tcl -notrace



****** Vivado v2025.1 (64-bit)
  **** SW Build 6140274 on Thu May 22 00:12:29 MDT 2025
  **** IP Build 6138677 on Thu May 22 03:10:11 MDT 2025
  **** SharedData Build 6139179 on Tue May 20 17:58:58 MDT 2025
  **** Start of session at: Tue Nov 25 14:40:44 2025
    ** Copyright 1986-2022 Xilinx, Inc. All Rights Reserved.
    ** Copyright 2022-2025 Advanced Micro Devices, Inc. All Rights Reserved.

source top_processing.tcl -notrace
Command: link_design -top top_processing -part xc7z020clg484-1
Design is defaulting to srcset: sources_1
Design is defaulting to constrset: constrs_1
INFO: [Device 21-403] Loading part xc7z020clg484-1
Netlist sorting complete. Time (s): cpu = 00:00:00 ; elapsed = 00:00:00.005 . Memory (MB): peak = 729.109 ; gain = 0.000
INFO: [Netlist 29-17] Analyzing 122 Unisim elements for replacement
INFO: [Netlist 29-28] Unisim Transformation completed in 0 CPU seconds
INFO: [Project 1-479] Netlist was created with Vivado 2025.1
INFO: [Project 1-570] Preparing netlist for logic optimization
Parsing XDC File [C:/Users/iamri/Documents/Subham_UART/uartblock_purePL/uartblock_purePL.srcs/constrs_1/new/jA1_ld0.xdc]
Finished Parsing XDC File [C:/Users/iamri/Documents/Subham_UART/uartblock_purePL/uartblock_purePL.srcs/constrs_1/new/jA1_ld0.xdc]
INFO: [Opt 31-138] Pushed 0 inverter(s) to 0 load pin(s).
Netlist sorting complete. Time (s): cpu = 00:00:00 ; elapsed = 00:00:00 . Memory (MB): peak = 855.008 ; gain = 0.000
INFO: [Project 1-111] Unisim Transformation Summary:
No Unisim elements were transformed.

7 Infos, 0 Warnings, 0 Critical Warnings and 0 Errors encountered.
link_design completed successfully
Command: opt_design
Attempting to get a license for feature 'Implementation' and/or device 'xc7z020'
INFO: [Common 17-349] Got license for feature 'Implementation' and/or device 'xc7z020'
Running DRC as a precondition to command opt_design

Starting DRC Task
INFO: [DRC 23-27] Running DRC with 2 threads
INFO: [Project 1-461] DRC finished with 0 Errors
INFO: [Project 1-462] Please refer to the DRC report (report_drc) for more information.

Time (s): cpu = 00:00:02 ; elapsed = 00:00:01 . Memory (MB): peak = 901.113 ; gain = 41.066

Starting Cache Timing Information Task
INFO: [Timing 38-35] Done setting XDC timing constraints.
Ending Cache Timing Information Task | Checksum: 20751d68c

Time (s): cpu = 00:00:05 ; elapsed = 00:00:06 . Memory (MB): peak = 1432.875 ; gain = 531.762

Starting Logic Optimization Task

Phase 1 Initialization

Phase 1.1 Core Generation And Design Setup
Phase 1.1 Core Generation And Design Setup | Checksum: 20751d68c

Time (s): cpu = 00:00:00 ; elapsed = 00:00:00.001 . Memory (MB): peak = 1863.664 ; gain = 0.000

Phase 1.2 Setup Constraints And Sort Netlist
Phase 1.2 Setup Constraints And Sort Netlist | Checksum: 20751d68c

Time (s): cpu = 00:00:00 ; elapsed = 00:00:00.002 . Memory (MB): peak = 1863.664 ; gain = 0.000
Phase 1 Initialization | Checksum: 20751d68c

Time (s): cpu = 00:00:00 ; elapsed = 00:00:00.002 . Memory (MB): peak = 1863.664 ; gain = 0.000

Phase 2 Timer Update And Timing Data Collection

Phase 2.1 Timer Update
Phase 2.1 Timer Update | Checksum: 20751d68c

Time (s): cpu = 00:00:00 ; elapsed = 00:00:00.022 . Memory (MB): peak = 1863.664 ; gain = 0.000

Phase 2.2 Timing Data Collection
Phase 2.2 Timing Data Collection | Checksum: 20751d68c

Time (s): cpu = 00:00:00 ; elapsed = 00:00:00.027 . Memory (MB): peak = 1863.664 ; gain = 0.000
Phase 2 Timer Update And Timing Data Collection | Checksum: 20751d68c

Time (s): cpu = 00:00:00 ; elapsed = 00:00:00.027 . Memory (MB): peak = 1863.664 ; gain = 0.000

Phase 3 Retarget
INFO: [Opt 31-1851] Number of loadless carry chains removed were: 0
INFO: [Opt 31-1834] Total Chains To Be Transformed Were: 0 AND Number of Transformed insts Created are: 0
INFO: [Opt 31-138] Pushed 0 inverter(s) to 0 load pin(s).
INFO: [Opt 31-49] Retargeted 0 cell(s).
Phase 3 Retarget | Checksum: 1955953c5

Time (s): cpu = 00:00:00 ; elapsed = 00:00:00.039 . Memory (MB): peak = 1863.664 ; gain = 0.000
Retarget | Checksum: 1955953c5
INFO: [Opt 31-389] Phase Retarget created 0 cells and removed 0 cells

Phase 4 Constant propagation
INFO: [Opt 31-138] Pushed 0 inverter(s) to 0 load pin(s).
Phase 4 Constant propagation | Checksum: 1955953c5

Time (s): cpu = 00:00:00 ; elapsed = 00:00:00.043 . Memory (MB): peak = 1863.664 ; gain = 0.000
Constant propagation | Checksum: 1955953c5
INFO: [Opt 31-389] Phase Constant propagation created 0 cells and removed 0 cells

Phase 5 Sweep
INFO: [Constraints 18-11670] Building netlist checker database with flags, 0x8
Done building netlist checker database: Time (s): cpu = 00:00:00 ; elapsed = 00:00:00 . Memory (MB): peak = 1863.664 ; gain = 0.000
Phase 5 Sweep | Checksum: 168e7562f

Time (s): cpu = 00:00:00 ; elapsed = 00:00:00.052 . Memory (MB): peak = 1863.664 ; gain = 0.000
Sweep | Checksum: 168e7562f
INFO: [Opt 31-389] Phase Sweep created 0 cells and removed 0 cells

Phase 6 BUFG optimization
Phase 6 BUFG optimization | Checksum: 168e7562f

Time (s): cpu = 00:00:00 ; elapsed = 00:00:00.065 . Memory (MB): peak = 1863.664 ; gain = 0.000
BUFG optimization | Checksum: 168e7562f
INFO: [Opt 31-662] Phase BUFG optimization created 0 cells of which 0 are BUFGs and removed 0 cells.

Phase 7 Shift Register Optimization
INFO: [Opt 31-1064] SRL Remap converted 0 SRLs to 0 registers and converted 0 registers of register chains to 0 SRLs
Phase 7 Shift Register Optimization | Checksum: 168e7562f

Time (s): cpu = 00:00:00 ; elapsed = 00:00:00.066 . Memory (MB): peak = 1863.664 ; gain = 0.000
Shift Register Optimization | Checksum: 168e7562f
INFO: [Opt 31-389] Phase Shift Register Optimization created 0 cells and removed 0 cells

Phase 8 Post Processing Netlist
Phase 8 Post Processing Netlist | Checksum: 168e7562f

Time (s): cpu = 00:00:00 ; elapsed = 00:00:00.070 . Memory (MB): peak = 1863.664 ; gain = 0.000
Post Processing Netlist | Checksum: 168e7562f
INFO: [Opt 31-389] Phase Post Processing Netlist created 0 cells and removed 0 cells

Phase 9 Finalization

Phase 9.1 Finalizing Design Cores and Updating Shapes
Phase 9.1 Finalizing Design Cores and Updating Shapes | Checksum: 21013cfea

Time (s): cpu = 00:00:00 ; elapsed = 00:00:00.096 . Memory (MB): peak = 1863.664 ; gain = 0.000

Phase 9.2 Verifying Netlist Connectivity

Starting Connectivity Check Task

Time (s): cpu = 00:00:00 ; elapsed = 00:00:00.003 . Memory (MB): peak = 1863.664 ; gain = 0.000
Phase 9.2 Verifying Netlist Connectivity | Checksum: 21013cfea

Time (s): cpu = 00:00:00 ; elapsed = 00:00:00.100 . Memory (MB): peak = 1863.664 ; gain = 0.000
Phase 9 Finalization | Checksum: 21013cfea

Time (s): cpu = 00:00:00 ; elapsed = 00:00:00.100 . Memory (MB): peak = 1863.664 ; gain = 0.000
Opt_design Change Summary
=========================


-------------------------------------------------------------------------------------------------------------------------
|  Phase                        |  #Cells created  |  #Cells Removed  |  #Constrained objects preventing optimizations  |
-------------------------------------------------------------------------------------------------------------------------
|  Retarget                     |               0  |               0  |                                              0  |
|  Constant propagation         |               0  |               0  |                                              0  |
|  Sweep                        |               0  |               0  |                                              0  |
|  BUFG optimization            |               0  |               0  |                                              0  |
|  Shift Register Optimization  |               0  |               0  |                                              0  |
|  Post Processing Netlist      |               0  |               0  |                                              0  |
-------------------------------------------------------------------------------------------------------------------------


Ending Logic Optimization Task | Checksum: 21013cfea

Time (s): cpu = 00:00:00 ; elapsed = 00:00:00.101 . Memory (MB): peak = 1863.664 ; gain = 0.000

Starting Power Optimization Task
INFO: [Pwropt 34-132] Skipping clock gating for clocks with a period < 2.00 ns.
INFO: [Pwropt 34-203] Number of nets are not same before and after processing of findDistanceFromSourceAndDest. Before: 125 After: 146
INFO: [Pwropt 34-9] Applying IDT optimizations ...
INFO: [Pwropt 34-10] Applying ODC optimizations ...
INFO: [Timing 38-35] Done setting XDC timing constraints.
WARNING: [Power 33-232] No user defined clocks were found in the design! Power estimation will be inaccurate until this is corrected.
Resolution: Please specify clocks using create_clock/create_generated_clock for sequential elements. For pure combinatorial circuits, please specify a virtual clock, otherwise the vectorless estimation might be inaccurate
Running Vector-less Activity Propagation...

Finished Running Vector-less Activity Propagation


Starting PowerOpt Patch Enables Task
INFO: [Pwropt 34-162] WRITE_MODE attribute of 0 BRAM(s) out of a total of 2 has been updated to save power. Run report_power_opt to get a complete listing of the BRAMs updated.
INFO: [Pwropt 34-201] Structural ODC has moved 0 WE to EN ports
Number of BRAM Ports augmented: 2 newly gated: 0 Total Ports: 4
Ending PowerOpt Patch Enables Task | Checksum: 2893b4cfa

Time (s): cpu = 00:00:00 ; elapsed = 00:00:00.009 . Memory (MB): peak = 1929.637 ; gain = 0.000
Ending Power Optimization Task | Checksum: 2893b4cfa

Time (s): cpu = 00:00:00 ; elapsed = 00:00:00.512 . Memory (MB): peak = 1929.637 ; gain = 65.973

Starting Final Cleanup Task
Ending Final Cleanup Task | Checksum: 2893b4cfa

Time (s): cpu = 00:00:00 ; elapsed = 00:00:00 . Memory (MB): peak = 1929.637 ; gain = 0.000

Starting Netlist Obfuscation Task
Netlist sorting complete. Time (s): cpu = 00:00:00 ; elapsed = 00:00:00.001 . Memory (MB): peak = 1929.637 ; gain = 0.000
Ending Netlist Obfuscation Task | Checksum: 1ed573f96

Time (s): cpu = 00:00:00 ; elapsed = 00:00:00.001 . Memory (MB): peak = 1929.637 ; gain = 0.000
INFO: [Common 17-83] Releasing license: Implementation
33 Infos, 1 Warnings, 0 Critical Warnings and 0 Errors encountered.
opt_design completed successfully
opt_design: Time (s): cpu = 00:00:10 ; elapsed = 00:00:10 . Memory (MB): peak = 1929.637 ; gain = 1069.590
INFO: [Vivado 12-24828] Executing command : report_drc -file top_processing_drc_opted.rpt -pb top_processing_drc_opted.pb -rpx top_processing_drc_opted.rpx
Command: report_drc -file top_processing_drc_opted.rpt -pb top_processing_drc_opted.pb -rpx top_processing_drc_opted.rpx
INFO: [IP_Flow 19-234] Refreshing IP repositories
INFO: [IP_Flow 19-1704] No user IP repositories specified
INFO: [IP_Flow 19-2313] Loaded Vivado IP repository 'C:/Xilinx/2025.1/Vivado/data/ip'.
INFO: [DRC 23-27] Running DRC with 2 threads
INFO: [Vivado_Tcl 2-168] The results of DRC are in file C:/Users/iamri/Documents/Subham_UART/uartblock_purePL/uartblock_purePL.runs/impl_1/top_processing_drc_opted.rpt.
report_drc completed successfully
INFO: [Timing 38-480] Writing timing data to binary archive.
Wrote PlaceDB: Time (s): cpu = 00:00:00 ; elapsed = 00:00:00.004 . Memory (MB): peak = 1929.637 ; gain = 0.000
Write ShapeDB Complete: Time (s): cpu = 00:00:01 ; elapsed = 00:00:00.017 . Memory (MB): peak = 1929.637 ; gain = 0.000
Wrote PulsedLatchDB: Time (s): cpu = 00:00:00 ; elapsed = 00:00:00 . Memory (MB): peak = 1929.637 ; gain = 0.000
Writing XDEF routing.
Writing XDEF routing logical nets.
Writing XDEF routing special nets.
Wrote RouteStorage: Time (s): cpu = 00:00:00 ; elapsed = 00:00:00.061 . Memory (MB): peak = 1929.637 ; gain = 0.000
Wrote Netlist Cache: Time (s): cpu = 00:00:00 ; elapsed = 00:00:00 . Memory (MB): peak = 1929.637 ; gain = 0.000
Wrote Device Cache: Time (s): cpu = 00:00:00 ; elapsed = 00:00:00.021 . Memory (MB): peak = 1929.637 ; gain = 0.000
Write Physdb Complete: Time (s): cpu = 00:00:01 ; elapsed = 00:00:00.103 . Memory (MB): peak = 1929.637 ; gain = 0.000
INFO: [Common 17-1381] The checkpoint 'C:/Users/iamri/Documents/Subham_UART/uartblock_purePL/uartblock_purePL.runs/impl_1/top_processing_opt.dcp' has been generated.
Command: place_design
Attempting to get a license for feature 'Implementation' and/or device 'xc7z020'
INFO: [Common 17-349] Got license for feature 'Implementation' and/or device 'xc7z020'
INFO: [Common 17-83] Releasing license: Implementation
INFO: [DRC 23-27] Running DRC with 2 threads
INFO: [Vivado_Tcl 4-198] DRC finished with 0 Errors
INFO: [Vivado_Tcl 4-199] Please refer to the DRC report (report_drc) for more information.
Running DRC as a precondition to command place_design
INFO: [DRC 23-27] Running DRC with 2 threads
INFO: [Vivado_Tcl 4-198] DRC finished with 0 Errors
INFO: [Vivado_Tcl 4-199] Please refer to the DRC report (report_drc) for more information.
INFO: [Place 30-611] Multithreading enabled for place_design using a maximum of 2 CPUs

Starting Placer Task

Phase 1 Placer Initialization

Phase 1.1 Placer Initialization Netlist Sorting
Netlist sorting complete. Time (s): cpu = 00:00:00 ; elapsed = 00:00:00 . Memory (MB): peak = 1929.637 ; gain = 0.000
Phase 1.1 Placer Initialization Netlist Sorting | Checksum: 190301cb9

Time (s): cpu = 00:00:00 ; elapsed = 00:00:00.001 . Memory (MB): peak = 1929.637 ; gain = 0.000
Netlist sorting complete. Time (s): cpu = 00:00:00 ; elapsed = 00:00:00 . Memory (MB): peak = 1929.637 ; gain = 0.000

Phase 1.2 IO Placement/ Clock Placement/ Build Placer Device
INFO: [Timing 38-35] Done setting XDC timing constraints.
Phase 1.2 IO Placement/ Clock Placement/ Build Placer Device | Checksum: acfc3e7b

Time (s): cpu = 00:00:00 ; elapsed = 00:00:00.202 . Memory (MB): peak = 1929.637 ; gain = 0.000

Phase 1.3 Build Placer Netlist Model
Phase 1.3 Build Placer Netlist Model | Checksum: e520b37c

Time (s): cpu = 00:00:00 ; elapsed = 00:00:00.252 . Memory (MB): peak = 1929.637 ; gain = 0.000

Phase 1.4 Constrain Clocks/Macros
Phase 1.4 Constrain Clocks/Macros | Checksum: e520b37c

Time (s): cpu = 00:00:00 ; elapsed = 00:00:00.255 . Memory (MB): peak = 1929.637 ; gain = 0.000
Phase 1 Placer Initialization | Checksum: e520b37c

Time (s): cpu = 00:00:00 ; elapsed = 00:00:00.256 . Memory (MB): peak = 1929.637 ; gain = 0.000

Phase 2 Global Placement

Phase 2.1 Floorplanning
Phase 2.1 Floorplanning | Checksum: e520b37c

Time (s): cpu = 00:00:00 ; elapsed = 00:00:00.258 . Memory (MB): peak = 1929.637 ; gain = 0.000

Phase 2.2 Update Timing before SLR Path Opt
Phase 2.2 Update Timing before SLR Path Opt | Checksum: e520b37c

Time (s): cpu = 00:00:00 ; elapsed = 00:00:00.259 . Memory (MB): peak = 1929.637 ; gain = 0.000

Phase 2.3 Post-Processing in Floorplanning
Phase 2.3 Post-Processing in Floorplanning | Checksum: e520b37c

Time (s): cpu = 00:00:00 ; elapsed = 00:00:00.259 . Memory (MB): peak = 1929.637 ; gain = 0.000

Phase 2.4 Global Place Phase1
Phase 2.4 Global Place Phase1 | Checksum: 184255590

Time (s): cpu = 00:00:01 ; elapsed = 00:00:00.493 . Memory (MB): peak = 1929.637 ; gain = 0.000

Phase 2.5 Global Place Phase2
WARNING: [Place 46-29] Timing had been disabled during Placer and, therefore, physical synthesis in Placer will be skipped.
Phase 2.5 Global Place Phase2 | Checksum: 116189f8b

Time (s): cpu = 00:00:01 ; elapsed = 00:00:00.555 . Memory (MB): peak = 1929.637 ; gain = 0.000
Phase 2 Global Placement | Checksum: 116189f8b

Time (s): cpu = 00:00:01 ; elapsed = 00:00:00.558 . Memory (MB): peak = 1929.637 ; gain = 0.000

Phase 3 Detail Placement

Phase 3.1 Commit Multi Column Macros
Phase 3.1 Commit Multi Column Macros | Checksum: 116189f8b

Time (s): cpu = 00:00:01 ; elapsed = 00:00:00.562 . Memory (MB): peak = 1929.637 ; gain = 0.000

Phase 3.2 Commit Most Macros & LUTRAMs
Phase 3.2 Commit Most Macros & LUTRAMs | Checksum: 1f2fb698c

Time (s): cpu = 00:00:01 ; elapsed = 00:00:00.587 . Memory (MB): peak = 1929.637 ; gain = 0.000

Phase 3.3 Area Swap Optimization
Phase 3.3 Area Swap Optimization | Checksum: 1bb038963

Time (s): cpu = 00:00:01 ; elapsed = 00:00:00.593 . Memory (MB): peak = 1929.637 ; gain = 0.000

Phase 3.4 Pipeline Register Optimization
Phase 3.4 Pipeline Register Optimization | Checksum: 1bb038963

Time (s): cpu = 00:00:01 ; elapsed = 00:00:00.596 . Memory (MB): peak = 1929.637 ; gain = 0.000

Phase 3.5 Small Shape Detail Placement
Phase 3.5 Small Shape Detail Placement | Checksum: 225295d92

Time (s): cpu = 00:00:01 ; elapsed = 00:00:00.747 . Memory (MB): peak = 1929.637 ; gain = 0.000

Phase 3.6 Re-assign LUT pins
Phase 3.6 Re-assign LUT pins | Checksum: 225295d92

Time (s): cpu = 00:00:01 ; elapsed = 00:00:00.779 . Memory (MB): peak = 1929.637 ; gain = 0.000

Phase 3.7 Pipeline Register Optimization
Phase 3.7 Pipeline Register Optimization | Checksum: 225295d92

Time (s): cpu = 00:00:01 ; elapsed = 00:00:00.783 . Memory (MB): peak = 1929.637 ; gain = 0.000
Phase 3 Detail Placement | Checksum: 225295d92

Time (s): cpu = 00:00:01 ; elapsed = 00:00:00.786 . Memory (MB): peak = 1929.637 ; gain = 0.000

Phase 4 Post Placement Optimization and Clean-Up

Phase 4.1 Post Commit Optimization
Phase 4.1 Post Commit Optimization | Checksum: 225295d92

Time (s): cpu = 00:00:01 ; elapsed = 00:00:00.810 . Memory (MB): peak = 1929.637 ; gain = 0.000

Phase 4.2 Post Placement Cleanup
Phase 4.2 Post Placement Cleanup | Checksum: 225295d92

Time (s): cpu = 00:00:01 ; elapsed = 00:00:00.816 . Memory (MB): peak = 1929.637 ; gain = 0.000

Phase 4.3 Placer Reporting

Phase 4.3.1 Print Estimated Congestion
INFO: [Place 30-612] Post-Placement Estimated Congestion 
 ____________________________________________________
|           | Global Congestion | Short Congestion  |
| Direction | Region Size       | Region Size       |
|___________|___________________|___________________|
|      North|                1x1|                1x1|
|___________|___________________|___________________|
|      South|                1x1|                1x1|
|___________|___________________|___________________|
|       East|                1x1|                1x1|
|___________|___________________|___________________|
|       West|                1x1|                1x1|
|___________|___________________|___________________|

Phase 4.3.1 Print Estimated Congestion | Checksum: 225295d92

Time (s): cpu = 00:00:01 ; elapsed = 00:00:00.820 . Memory (MB): peak = 1929.637 ; gain = 0.000
Phase 4.3 Placer Reporting | Checksum: 225295d92

Time (s): cpu = 00:00:01 ; elapsed = 00:00:00.823 . Memory (MB): peak = 1929.637 ; gain = 0.000

Phase 4.4 Final Placement Cleanup
Netlist sorting complete. Time (s): cpu = 00:00:00 ; elapsed = 00:00:00.001 . Memory (MB): peak = 1929.637 ; gain = 0.000

Time (s): cpu = 00:00:01 ; elapsed = 00:00:00.824 . Memory (MB): peak = 1929.637 ; gain = 0.000
Phase 4 Post Placement Optimization and Clean-Up | Checksum: 2215591bf

Time (s): cpu = 00:00:01 ; elapsed = 00:00:00.827 . Memory (MB): peak = 1929.637 ; gain = 0.000
Ending Placer Task | Checksum: 1433f66b9

Time (s): cpu = 00:00:01 ; elapsed = 00:00:00.830 . Memory (MB): peak = 1929.637 ; gain = 0.000
52 Infos, 2 Warnings, 0 Critical Warnings and 0 Errors encountered.
place_design completed successfully
INFO: [Vivado 12-24838] Running report commands "report_control_sets, report_io, report_utilization" in parallel.
Running report generation with 2 threads.
INFO: [Vivado 12-24828] Executing command : report_utilization -file top_processing_utilization_placed.rpt -pb top_processing_utilization_placed.pb
INFO: [Vivado 12-24828] Executing command : report_control_sets -verbose -file top_processing_control_sets_placed.rpt
report_control_sets: Time (s): cpu = 00:00:00 ; elapsed = 00:00:00.004 . Memory (MB): peak = 1929.637 ; gain = 0.000
INFO: [Vivado 12-24828] Executing command : report_io -file top_processing_io_placed.rpt
report_io: Time (s): cpu = 00:00:00 ; elapsed = 00:00:00.045 . Memory (MB): peak = 1929.637 ; gain = 0.000
Write ShapeDB Complete: Time (s): cpu = 00:00:00 ; elapsed = 00:00:00.003 . Memory (MB): peak = 1929.637 ; gain = 0.000
INFO: [Timing 38-480] Writing timing data to binary archive.
Wrote PlaceDB: Time (s): cpu = 00:00:00 ; elapsed = 00:00:00.054 . Memory (MB): peak = 1929.637 ; gain = 0.000
Wrote PulsedLatchDB: Time (s): cpu = 00:00:00 ; elapsed = 00:00:00 . Memory (MB): peak = 1929.637 ; gain = 0.000
Writing XDEF routing.
Writing XDEF routing logical nets.
Writing XDEF routing special nets.
Wrote RouteStorage: Time (s): cpu = 00:00:01 ; elapsed = 00:00:00.017 . Memory (MB): peak = 1929.637 ; gain = 0.000
Wrote Netlist Cache: Time (s): cpu = 00:00:00 ; elapsed = 00:00:00.001 . Memory (MB): peak = 1929.637 ; gain = 0.000
Wrote Device Cache: Time (s): cpu = 00:00:00 ; elapsed = 00:00:00.007 . Memory (MB): peak = 1929.637 ; gain = 0.000
Write Physdb Complete: Time (s): cpu = 00:00:01 ; elapsed = 00:00:00.085 . Memory (MB): peak = 1929.637 ; gain = 0.000
INFO: [Common 17-1381] The checkpoint 'C:/Users/iamri/Documents/Subham_UART/uartblock_purePL/uartblock_purePL.runs/impl_1/top_processing_placed.dcp' has been generated.
Command: phys_opt_design
Attempting to get a license for feature 'Implementation' and/or device 'xc7z020'
INFO: [Common 17-349] Got license for feature 'Implementation' and/or device 'xc7z020'

Starting Initial Update Timing Task

Time (s): cpu = 00:00:00 ; elapsed = 00:00:00.037 . Memory (MB): peak = 1929.637 ; gain = 0.000
INFO: [Vivado_Tcl 4-235] No timing constraint found. The netlist was not modified.
INFO: [Common 17-83] Releasing license: Implementation
61 Infos, 2 Warnings, 0 Critical Warnings and 0 Errors encountered.
phys_opt_design completed successfully
INFO: [Timing 38-480] Writing timing data to binary archive.
Write ShapeDB Complete: Time (s): cpu = 00:00:00 ; elapsed = 00:00:00.004 . Memory (MB): peak = 1929.637 ; gain = 0.000
Wrote PlaceDB: Time (s): cpu = 00:00:00 ; elapsed = 00:00:00.107 . Memory (MB): peak = 1929.637 ; gain = 0.000
Wrote PulsedLatchDB: Time (s): cpu = 00:00:00 ; elapsed = 00:00:00 . Memory (MB): peak = 1929.637 ; gain = 0.000
Writing XDEF routing.
Writing XDEF routing logical nets.
Writing XDEF routing special nets.
Wrote RouteStorage: Time (s): cpu = 00:00:00 ; elapsed = 00:00:00.027 . Memory (MB): peak = 1929.637 ; gain = 0.000
Wrote Netlist Cache: Time (s): cpu = 00:00:00 ; elapsed = 00:00:00.002 . Memory (MB): peak = 1929.637 ; gain = 0.000
Wrote Device Cache: Time (s): cpu = 00:00:00 ; elapsed = 00:00:00.007 . Memory (MB): peak = 1929.637 ; gain = 0.000
Write Physdb Complete: Time (s): cpu = 00:00:00 ; elapsed = 00:00:00.151 . Memory (MB): peak = 1929.637 ; gain = 0.000
INFO: [Common 17-1381] The checkpoint 'C:/Users/iamri/Documents/Subham_UART/uartblock_purePL/uartblock_purePL.runs/impl_1/top_processing_physopt.dcp' has been generated.
Command: route_design
Attempting to get a license for feature 'Implementation' and/or device 'xc7z020'
INFO: [Common 17-349] Got license for feature 'Implementation' and/or device 'xc7z020'


Starting Routing Task
INFO: [Route 35-254] Multithreading enabled for route_design using a maximum of 2 CPUs

Phase 1 Build RT Design
Checksum: PlaceDB: fd3dee87 ConstDB: 0 ShapeSum: 30080542 RouteDB: 15f972f0
Post Restoration Checksum: NetGraph: 1e197568 | NumContArr: bd484790 | Constraints: c2a8fa9d | Timing: c2a8fa9d
Phase 1 Build RT Design | Checksum: 260b3b232

Time (s): cpu = 00:00:24 ; elapsed = 00:00:23 . Memory (MB): peak = 2006.301 ; gain = 76.664

Phase 2 Router Initialization
INFO: [Route 35-64] No timing constraints were detected. The router will operate in resource-optimization mode.

Phase 2.1 Fix Topology Constraints
Phase 2.1 Fix Topology Constraints | Checksum: 260b3b232

Time (s): cpu = 00:00:24 ; elapsed = 00:00:23 . Memory (MB): peak = 2013.992 ; gain = 84.355

Phase 2.2 Pre Route Cleanup
Phase 2.2 Pre Route Cleanup | Checksum: 260b3b232

Time (s): cpu = 00:00:24 ; elapsed = 00:00:23 . Memory (MB): peak = 2013.992 ; gain = 84.355
 Number of Nodes with overlaps = 0

Router Utilization Summary
  Global Vertical Routing Utilization    = 0 %
  Global Horizontal Routing Utilization  = 0 %
  Routable Net Status*
  *Does not include unroutable nets such as driverless and loadless.
  Run report_route_status for detailed report.
  Number of Failed Nets               = 967
    (Failed Nets is the sum of unrouted and partially routed nets)
  Number of Unrouted Nets             = 967
  Number of Partially Routed Nets     = 0
  Number of Node Overlaps             = 0

Phase 2 Router Initialization | Checksum: 27d8c11aa

Time (s): cpu = 00:00:24 ; elapsed = 00:00:23 . Memory (MB): peak = 2042.773 ; gain = 113.137

Phase 3 Global Routing
Phase 3 Global Routing | Checksum: 27d8c11aa

Time (s): cpu = 00:00:24 ; elapsed = 00:00:23 . Memory (MB): peak = 2042.773 ; gain = 113.137

Phase 4 Initial Routing

Phase 4.1 Initial Net Routing Pass
Phase 4.1 Initial Net Routing Pass | Checksum: 2504cb7aa

Time (s): cpu = 00:00:25 ; elapsed = 00:00:23 . Memory (MB): peak = 2042.773 ; gain = 113.137
Phase 4 Initial Routing | Checksum: 2504cb7aa

Time (s): cpu = 00:00:25 ; elapsed = 00:00:23 . Memory (MB): peak = 2042.773 ; gain = 113.137

Phase 5 Rip-up And Reroute

Phase 5.1 Global Iteration 0
 Number of Nodes with overlaps = 38
 Number of Nodes with overlaps = 0
Phase 5.1 Global Iteration 0 | Checksum: 31dac0071

Time (s): cpu = 00:00:25 ; elapsed = 00:00:23 . Memory (MB): peak = 2042.773 ; gain = 113.137
Phase 5 Rip-up And Reroute | Checksum: 31dac0071

Time (s): cpu = 00:00:25 ; elapsed = 00:00:23 . Memory (MB): peak = 2042.773 ; gain = 113.137

Phase 6 Delay and Skew Optimization
Phase 6 Delay and Skew Optimization | Checksum: 31dac0071

Time (s): cpu = 00:00:25 ; elapsed = 00:00:23 . Memory (MB): peak = 2042.773 ; gain = 113.137

Phase 7 Post Hold Fix

Phase 7.1 Hold Fix Iter
Phase 7.1 Hold Fix Iter | Checksum: 31dac0071

Time (s): cpu = 00:00:25 ; elapsed = 00:00:23 . Memory (MB): peak = 2042.773 ; gain = 113.137
Phase 7 Post Hold Fix | Checksum: 31dac0071

Time (s): cpu = 00:00:25 ; elapsed = 00:00:23 . Memory (MB): peak = 2042.773 ; gain = 113.137

Phase 8 Route finalize

Router Utilization Summary
  Global Vertical Routing Utilization    = 0.0915398 %
  Global Horizontal Routing Utilization  = 0.12238 %
  Routable Net Status*
  *Does not include unroutable nets such as driverless and loadless.
  Run report_route_status for detailed report.
  Number of Failed Nets               = 0
    (Failed Nets is the sum of unrouted and partially routed nets)
  Number of Unrouted Nets             = 0
  Number of Partially Routed Nets     = 0
  Number of Node Overlaps             = 0


--GLOBAL Congestion:
Utilization threshold used for congestion level computation: 0.85
Congestion Report
North Dir 1x1 Area, Max Cong = 25.2252%, No Congested Regions.
South Dir 1x1 Area, Max Cong = 16.2162%, No Congested Regions.
East Dir 1x1 Area, Max Cong = 20.5882%, No Congested Regions.
West Dir 1x1 Area, Max Cong = 25%, No Congested Regions.

------------------------------
Reporting congestion hotspots
------------------------------
Direction: North
----------------
Congested clusters found at Level 0
Effective congestion level: 0 Aspect Ratio: 1 Sparse Ratio: 0
Direction: South
----------------
Congested clusters found at Level 0
Effective congestion level: 0 Aspect Ratio: 1 Sparse Ratio: 0
Direction: East
----------------
Congested clusters found at Level 0
Effective congestion level: 0 Aspect Ratio: 1 Sparse Ratio: 0
Direction: West
----------------
Congested clusters found at Level 0
Effective congestion level: 0 Aspect Ratio: 1 Sparse Ratio: 0

Phase 8 Route finalize | Checksum: 31dac0071

Time (s): cpu = 00:00:25 ; elapsed = 00:00:23 . Memory (MB): peak = 2042.773 ; gain = 113.137

Phase 9 Verifying routed nets

 Verification completed successfully
Phase 9 Verifying routed nets | Checksum: 31dac0071

Time (s): cpu = 00:00:25 ; elapsed = 00:00:23 . Memory (MB): peak = 2042.773 ; gain = 113.137

Phase 10 Depositing Routes
Phase 10 Depositing Routes | Checksum: 31998cea7

Time (s): cpu = 00:00:25 ; elapsed = 00:00:23 . Memory (MB): peak = 2042.773 ; gain = 113.137

Phase 11 Post Process Routing
Phase 11 Post Process Routing | Checksum: 31998cea7

Time (s): cpu = 00:00:25 ; elapsed = 00:00:23 . Memory (MB): peak = 2042.773 ; gain = 113.137
Total Elapsed time in route_design: 23.403 secs

Phase 12 Post-Route Event Processing
Phase 12 Post-Route Event Processing | Checksum: fe92464f

Time (s): cpu = 00:00:25 ; elapsed = 00:00:23 . Memory (MB): peak = 2042.773 ; gain = 113.137
INFO: [Route 35-16] Router Completed Successfully
Ending Routing Task | Checksum: fe92464f

Time (s): cpu = 00:00:25 ; elapsed = 00:00:23 . Memory (MB): peak = 2042.773 ; gain = 113.137

Routing Is Done.
INFO: [Common 17-83] Releasing license: Implementation
68 Infos, 2 Warnings, 0 Critical Warnings and 0 Errors encountered.
route_design completed successfully
route_design: Time (s): cpu = 00:00:25 ; elapsed = 00:00:23 . Memory (MB): peak = 2042.773 ; gain = 113.137
INFO: [Vivado 12-24828] Executing command : report_drc -file top_processing_drc_routed.rpt -pb top_processing_drc_routed.pb -rpx top_processing_drc_routed.rpx
Command: report_drc -file top_processing_drc_routed.rpt -pb top_processing_drc_routed.pb -rpx top_processing_drc_routed.rpx
INFO: [IP_Flow 19-1839] IP Catalog is up to date.
INFO: [DRC 23-27] Running DRC with 2 threads
INFO: [Vivado_Tcl 2-168] The results of DRC are in file C:/Users/iamri/Documents/Subham_UART/uartblock_purePL/uartblock_purePL.runs/impl_1/top_processing_drc_routed.rpt.
report_drc completed successfully
INFO: [Vivado 12-24828] Executing command : report_methodology -file top_processing_methodology_drc_routed.rpt -pb top_processing_methodology_drc_routed.pb -rpx top_processing_methodology_drc_routed.rpx
Command: report_methodology -file top_processing_methodology_drc_routed.rpt -pb top_processing_methodology_drc_routed.pb -rpx top_processing_methodology_drc_routed.rpx
INFO: [Timing 38-35] Done setting XDC timing constraints.
INFO: [DRC 23-133] Running Methodology with 2 threads
INFO: [Vivado_Tcl 2-1520] The results of Report Methodology are in file C:/Users/iamri/Documents/Subham_UART/uartblock_purePL/uartblock_purePL.runs/impl_1/top_processing_methodology_drc_routed.rpt.
report_methodology completed successfully
INFO: [Vivado 12-24828] Executing command : report_timing_summary -max_paths 10 -report_unconstrained -file top_processing_timing_summary_routed.rpt -pb top_processing_timing_summary_routed.pb -rpx top_processing_timing_summary_routed.rpx -warn_on_violation 
INFO: [Timing 38-35] Done setting XDC timing constraints.
INFO: [Timing 38-91] UpdateTimingParams: Speed grade: -1, Delay Type: min_max.
INFO: [Timing 38-191] Multithreading enabled for timing update using a maximum of 2 CPUs
WARNING: [Timing 38-313] There are no user specified timing constraints. Timing constraints are needed for proper timing analysis.
INFO: [Vivado 12-24838] Running report commands "report_incremental_reuse, report_route_status" in parallel.
Running report generation with 2 threads.
INFO: [Vivado 12-24828] Executing command : report_incremental_reuse -file top_processing_incremental_reuse_routed.rpt
INFO: [Vivado_Tcl 4-1062] Incremental flow is disabled. No incremental reuse Info to report.
INFO: [Vivado 12-24828] Executing command : report_route_status -file top_processing_route_status.rpt -pb top_processing_route_status.pb
INFO: [Vivado 12-24828] Executing command : report_power -file top_processing_power_routed.rpt -pb top_processing_power_summary_routed.pb -rpx top_processing_power_routed.rpx
Command: report_power -file top_processing_power_routed.rpt -pb top_processing_power_summary_routed.pb -rpx top_processing_power_routed.rpx
WARNING: [Power 33-232] No user defined clocks were found in the design! Power estimation will be inaccurate until this is corrected.
Resolution: Please specify clocks using create_clock/create_generated_clock for sequential elements. For pure combinatorial circuits, please specify a virtual clock, otherwise the vectorless estimation might be inaccurate
Running Vector-less Activity Propagation...

Finished Running Vector-less Activity Propagation
85 Infos, 4 Warnings, 0 Critical Warnings and 0 Errors encountered.
report_power completed successfully
INFO: [Vivado 12-24828] Executing command : report_clock_utilization -file top_processing_clock_utilization_routed.rpt
INFO: [Vivado 12-24828] Executing command : report_bus_skew -warn_on_violation -file top_processing_bus_skew_routed.rpt -pb top_processing_bus_skew_routed.pb -rpx top_processing_bus_skew_routed.rpx
INFO: [Timing 38-91] UpdateTimingParams: Speed grade: -1, Delay Type: min_max.
INFO: [Timing 38-191] Multithreading enabled for timing update using a maximum of 2 CPUs
generate_parallel_reports: Time (s): cpu = 00:00:10 ; elapsed = 00:00:06 . Memory (MB): peak = 2119.301 ; gain = 76.527
INFO: [Timing 38-480] Writing timing data to binary archive.
Write ShapeDB Complete: Time (s): cpu = 00:00:00 ; elapsed = 00:00:00.031 . Memory (MB): peak = 2119.301 ; gain = 0.000
Wrote PlaceDB: Time (s): cpu = 00:00:00 ; elapsed = 00:00:00.143 . Memory (MB): peak = 2119.301 ; gain = 0.000
Wrote PulsedLatchDB: Time (s): cpu = 00:00:00 ; elapsed = 00:00:00 . Memory (MB): peak = 2119.301 ; gain = 0.000
Writing XDEF routing.
Writing XDEF routing logical nets.
Writing XDEF routing special nets.
Wrote RouteStorage: Time (s): cpu = 00:00:00 ; elapsed = 00:00:00.028 . Memory (MB): peak = 2119.301 ; gain = 0.000
Wrote Netlist Cache: Time (s): cpu = 00:00:00 ; elapsed = 00:00:00.001 . Memory (MB): peak = 2119.301 ; gain = 0.000
Wrote Device Cache: Time (s): cpu = 00:00:00 ; elapsed = 00:00:00.006 . Memory (MB): peak = 2119.301 ; gain = 0.000
Write Physdb Complete: Time (s): cpu = 00:00:00 ; elapsed = 00:00:00.188 . Memory (MB): peak = 2119.301 ; gain = 0.000
INFO: [Common 17-1381] The checkpoint 'C:/Users/iamri/Documents/Subham_UART/uartblock_purePL/uartblock_purePL.runs/impl_1/top_processing_routed.dcp' has been generated.
INFO: [Common 17-206] Exiting Vivado at Tue Nov 25 14:41:39 2025...

*** Running vivado
    with args -log top_processing.vdi -applog -m64 -product Vivado -messageDb vivado.pb -mode batch -source top_processing.tcl -notrace



****** Vivado v2025.1 (64-bit)
  **** SW Build 6140274 on Thu May 22 00:12:29 MDT 2025
  **** IP Build 6138677 on Thu May 22 03:10:11 MDT 2025
  **** SharedData Build 6139179 on Tue May 20 17:58:58 MDT 2025
  **** Start of session at: Tue Nov 25 14:42:00 2025
    ** Copyright 1986-2022 Xilinx, Inc. All Rights Reserved.
    ** Copyright 2022-2025 Advanced Micro Devices, Inc. All Rights Reserved.

source top_processing.tcl -notrace
Command: open_checkpoint top_processing_routed.dcp
INFO: [Device 21-403] Loading part xc7z020clg484-1
Netlist sorting complete. Time (s): cpu = 00:00:00 ; elapsed = 00:00:00.005 . Memory (MB): peak = 728.355 ; gain = 0.000
INFO: [Netlist 29-17] Analyzing 122 Unisim elements for replacement
INFO: [Netlist 29-28] Unisim Transformation completed in 0 CPU seconds
INFO: [Project 1-479] Netlist was created with Vivado 2025.1
INFO: [Project 1-570] Preparing netlist for logic optimization
Read ShapeDB Complete: Time (s): cpu = 00:00:00 ; elapsed = 00:00:00.005 . Memory (MB): peak = 823.793 ; gain = 0.207
INFO: [Timing 38-478] Restoring timing data from binary archive.
INFO: [Timing 38-479] Binary timing data restore complete.
INFO: [Project 1-856] Restoring constraints from binary archive.
INFO: [Project 1-853] Binary constraint restore complete.
INFO: [Designutils 20-5722] Start Reading Physical Databases.
Reading placement.
Read Netlist Cache: Time (s): cpu = 00:00:00 ; elapsed = 00:00:00.001 . Memory (MB): peak = 1417.773 ; gain = 0.000
Reading placer database...
Read Device Cache: Time (s): cpu = 00:00:00 ; elapsed = 00:00:00.009 . Memory (MB): peak = 1417.773 ; gain = 0.000
Read PlaceDB: Time (s): cpu = 00:00:00 ; elapsed = 00:00:00.029 . Memory (MB): peak = 1417.773 ; gain = 0.000
Read PulsedLatchDB: Time (s): cpu = 00:00:00 ; elapsed = 00:00:00 . Memory (MB): peak = 1417.773 ; gain = 0.000
Reading routing.
Read RouteStorage: Time (s): cpu = 00:00:00 ; elapsed = 00:00:00.013 . Memory (MB): peak = 1417.773 ; gain = 0.000
Read Physdb Files: Time (s): cpu = 00:00:00 ; elapsed = 00:00:00.061 . Memory (MB): peak = 1417.773 ; gain = 0.000
Restored from archive | CPU: 0.000000 secs | Memory: 0.000000 MB |
Finished XDEF File Restore: Time (s): cpu = 00:00:00 ; elapsed = 00:00:00.096 . Memory (MB): peak = 1417.773 ; gain = 15.551
Netlist sorting complete. Time (s): cpu = 00:00:00 ; elapsed = 00:00:00.001 . Memory (MB): peak = 1417.773 ; gain = 0.000
INFO: [Project 1-111] Unisim Transformation Summary:
No Unisim elements were transformed.

INFO: [Project 1-604] Checkpoint was created with Vivado v2025.1 (64-bit) build 6140274
WARNING: [Vivado 12-23575] Critical violations of the methodology design rules detected. Critical violations may contribute to timing failures or cause functional issues in hardware. Run report_methodology for more information.
open_checkpoint: Time (s): cpu = 00:00:14 ; elapsed = 00:00:13 . Memory (MB): peak = 1417.773 ; gain = 1144.645
Command: write_bitstream -force top_processing.bit
Attempting to get a license for feature 'Implementation' and/or device 'xc7z020'
INFO: [Common 17-349] Got license for feature 'Implementation' and/or device 'xc7z020'
Running DRC as a precondition to command write_bitstream
INFO: [IP_Flow 19-234] Refreshing IP repositories
INFO: [IP_Flow 19-1704] No user IP repositories specified
INFO: [IP_Flow 19-2313] Loaded Vivado IP repository 'C:/Xilinx/2025.1/Vivado/data/ip'.
INFO: [DRC 23-27] Running DRC with 2 threads
INFO: [Vivado 12-3199] DRC finished with 0 Errors
INFO: [Vivado 12-3200] Please refer to the DRC report (report_drc) for more information.
INFO: [Designutils 20-2272] Running write_bitstream with 2 threads.
Loading data files...
Loading site data...
Loading route data...
Processing options...
Creating bitmap...
Creating bitstream...
Writing bitstream ./top_processing.bit...
INFO: [Vivado 12-1842] Bitgen Completed Successfully.
INFO: [Project 1-1876] WebTalk data collection is mandatory when using a ULT device. To see the specific WebTalk data collected for your design, open the usage_statistics_webtalk.html or usage_statistics_webtalk.xml file in the implementation directory.
INFO: [Common 17-83] Releasing license: Implementation
23 Infos, 1 Warnings, 0 Critical Warnings and 0 Errors encountered.
write_bitstream completed successfully
write_bitstream: Time (s): cpu = 00:00:13 ; elapsed = 00:00:10 . Memory (MB): peak = 2001.508 ; gain = 583.734
INFO: [Common 17-206] Exiting Vivado at Tue Nov 25 14:42:25 2025...
